<?xml version="1.0" encoding="UTF-8"?>
<!-- editado con XMLSpy v2020 rel. 2 (x64) (http://www.altova.com) por Yosafat -->
<xs:schema xmlns:xs="http://www.w3.org/2001/XMLSchema" elementFormDefault="qualified">
	<xs:element name="RELACION_DE_COLUMNAS">
		<xs:complexType>
			<xs:sequence>
				<xs:element name="PREGUNTA" type="pregunta_type"/>
			</xs:sequence>
			
			<xs:attribute name="PLANTILLA" type="xs:string"/>
		</xs:complexType>
	</xs:element>
	
	<xs:complexType name="pregunta_type">
		<xs:sequence>
			<xs:element name="DRAGS" type="drag_and_target_type"/>
			<xs:element name="TARGETS" type="drag_and_target_type"/>
		</xs:sequence>
		
		<xs:attribute name="TEXTO" type="xs:string"/>
		<xs:attribute name="RESPUESTA" type="xs:string"/>
	</xs:complexType>
	
	<xs:complexType name="drag_and_target_type">
		<xs:sequence>
			<xs:element name="OPCION" type="opcion_type"/>
			<xs:element name="OPCION" type="opcion_type"/>
			<xs:element name="OPCION" type="opcion_type"/>
			<xs:element name="OPCION" type="opcion_type"/>
		</xs:sequence>
	</xs:complexType>
	
	<xs:complexType name="opcion_type">
		<xs:simpleContent>
			<xs:extension base="xs:string">
				<xs:attribute name="IMAGEN" type="xs:string"/>
			</xs:extension>
		</xs:simpleContent>
	</xs:complexType>
</xs:schema>
